user_input,retrieved_contexts,response,reference,context_precision,context_recall,faithfulness,answer_relevancy,category
What is HyDE (Hypothetical Document Embeddings) in the context of dense retrieval?,"['While dense retrieval has been shown effective and efficient across tasks and languages, it remains difficult to create effective fully zero-shot dense retrieval systems when no relevance label is available. In this paper, we recognize the difficulty of zero-shot learning and encoding relevance. Instead, we propose to pivot through Hypothetical Document Embeddings (HyDE). Given a query, HyDE first zero-shot instructs an instruction-following language model (e.g. InstructGPT) to generate a _hypothetical_ document. The document captures relevance patterns but is unreal and may contain false details. Then, an unsupervised contrastively learned encoder (e.g. Contriever) encodes the document into an embedding vector. This vector identifies a neighborhood in the corpus embedding space, where similar _real_ documents are retrieved based on vector similarity. This second step ground the generated document to the actual corpus, with the encoder’s dense bottleneck filtering out the incorrect details. Our experiments show that HyDE significantly outperforms the state-of-the-art unsupervised dense retriever Contriever and shows strong performance comparable to fine-tuned retrievers, across various tasks (e.g. web search, QA, fact verification) and languages (e.g. sw, ko, ja).[1]', '다...<br>instruction query generated document real document<br>**----- End of picture text -----**<br>\n\n\nFigure 1: An illustration of the HyDE model. Documents snippets are shown. HyDE serves all types of queries without changing the underlying GPT-3 and Contriever/mContriever models. \n\nto human intent to follow instructions. \n\nWith these ingredients, we propose to pivot through Hypothetical Document Embeddings (HyDE), and decompose dense retrieval into two tasks, a generative task performed by an instruction-following language model and a document-document similarity task performed by a contrastive encoder (Figure 1). First, we feed the query to the generative model and instruct it to ""write a document that answers the question"", i.e. a hypothetical document. We expect the generative process to capture ""relevance"" by giving an example; the generated document **is not** real, can contain factual errors but is like a relevant document. In the second step, we use an unsupervised contrastive encoder to encode this document into an embedding vector. Here, we expect the encoder’s dense bottleneck to serve a lossy compressor, where the extra (hallucinated) details are filtered out from the embedding. We use this vector to search against the corpus embeddings. The most similar _real_ documents are retrieved and returned. The retrieval leverages document-document similarity encoded in the inner-product during contrastive training. Note that, interestingly, with HyDE factorization, the query-document similarity score is no longer explicitly modeled nor computed. Instead, the retrieval task is cast into two NLU and NLG tasks. \n\nHyDE appears unsupervised. **No** model is trained in HyDE: both the generative model and the contrastive encoder remain intact. Supervision signals were only involved in instruction learning of our backbone LLM. \n\nIn our experiments, we show HyDE using InstructGPT (Ouyang et al., 2022) and Contriever (Izacard et al., 2021) as backbone models significantly outperforms the previous state-of-the-art Contrieveronly zero-shot no-relevance system on 11 queries \n\nsets, covering tasks like Web Search, Question Answering, Fact Verification and languages like Swahili, Korean, Japanese.', '> HyDE circumvents the aforementioned learning problem by performing search in documentonly embedding space that captures documentdocument similarity. This can be easily learned using unsupervised contrastive learning (Izacard et al., 2021; Gao et al., 2021; Gao and Callan, 2022). We set document encoder enc _d_ directly as a contrastive encoder enccon. \n\n**==> picture [152 x 11] intentionally omitted <==**\n\nThis function is also denoted as _f_ for simplicity. This unsupervised contrastive encoder will be shared by all incoming document corpus. \n\n**==> picture [203 x 12] intentionally omitted <==**\n\nTo build the query vector, we consider in addition an instruction following LM, InstructLM. It takes a query _q_ and a textual instruction INST and follows them to perform the task specified by INST. For simplicity, denote, \n\n**==> picture [188 x 12] intentionally omitted <==**\n\nIn this section, we first formally define the problem of (zero-shot) dense retrieval. Then we will introduce how HyDE is designed to solve it. \n\nNow we can use _g_ to map queries to ""hypothetical"" documents by sampling from _g_ , setting INST \n\nto be “write a paragraph that answers the question”. The generated document _is not_ real, can and is likely to be ungrounded factually (Brown et al., 2020; Thoppilan et al., 2022). We _only_ require it to capture relevance pattern. This is done by generating documents, i.e. providing examples. Critically, here we **offload** relevance modeling from representation learning model to an NLG model that generalizes significantly more easily, naturally, and effectively (Brown et al., 2020; Ouyang et al., 2022). Generating examples also replaces explicit modeling of relevance scores. We can now encode the generated document using the document encoder _f_ . Write, \n\n**==> picture [175 x 13] intentionally omitted <==**\n\nFormally, _g_ defines a probability distribution based on the chain rule. In this paper, we simply consider the expectation value, assuming the distribution of **v** _qij_ is uni-modal, i.e. the query is not ambiguous. The study of ambiguous queries and diversity is left to future work. We estimate Equation 5 by sampling _N_ documents from _g_ , [ _d_[', 'At the end of the paper, we encourage the readers to take a moment and reflect on the HyDE model. Compare it to some of the other recently seen retrievers or re-ranker. These other models probably differ in their architecture, training method, and/or task, but probably all of them involve modeling relevance scores between a pair of query and docu- \n\nment. Dense retrievers consider vector similarities while self-attentive re-rankers regression scores. In comparison, the concept of relevance in HyDE is captured by an NLG model and the language generation process. We demonstrate in many cases, HyDE can be as effective as dense retrievers that learn to model numerical relevance scores. So, is numerical relevance just a statistical artifact of language understanding? Will a weak retriever theoretically suffice as the NLU & NLG models rapidly become stronger? Rushing to conclusions is not smart; more works need to be done to get answers. With this paper, we just want to raise these questions. \n\nConcretely in this paper, we introduce a new paradigm of interactions between LLM and dense encoder/retriever. We demonstrate (part of) relevance modeling and instruction understanding can be delegated to the more powerful and flexible LLM. As a consequence, the need for relevance labels is removed. We are excited to see how this can be generalized further to more sophisticated tasks like multi-hop retrieval/QA and conversational search. \n\nWe argue HyDE is also of practical use though not necessarily over the entire lifespan of a search system. At the very beginning of the life of the search system, serving queries using HyDE offers performance comparable to a fine-tuned model, which no other relevance-free model can offer. As the search log grows, a supervised dense retriever can be gradually rolled out. As the dense retriever grows stronger, more queries will be routed to it, with only less common and emerging ones going to HyDE backend.']","## What is HyDE (Hypothetical Document Embeddings) in Dense Retrieval?

HyDE, or Hypothetical Document Embeddings, is a novel approach to dense retrieval that decomposes the retrieval process into two main tasks: generative document creation and document-document similarity matching (Precise Zero-Shot Dense Retrieval without Relevance Labels, 2022).

### Core Idea

- **Generative Step:** Given a query, an instruction-following language model (e.g., InstructGPT) generates a *hypothetical document* that represents what a relevant document might look like. This generated document is not a real document from the corpus but is intended to capture the relevance patterns implied by the query. It may contain inaccuracies but serves as a proxy for relevance (Precise Zero-Shot Dense Retrieval without Relevance Labels, 2022).

- **Embedding Step:** An unsupervised contrastive encoder (e.g., Contriever) encodes this hypothetical document into a dense embedding vector (Precise Zero-Shot Dense Retrieval without Relevance Labels, 2022).

- **Retrieval Step:** The embedding vector of the hypothetical document is then used to retrieve similar real documents from the corpus by measuring vector similarity. This transforms the retrieval problem into a document-to-document similarity search (Precise Zero-Shot Dense Retrieval without Relevance Labels, 2022).

### Key Characteristics

- **No Training Required:** HyDE leverages existing pretrained models for both generation and encoding, requiring no additional training or relevance labels (Precise Zero-Shot Dense Retrieval without Relevance Labels, 2022).

- **Zero-Shot Capability:** By generating hypothetical documents and using unsupervised contrastive embeddings, HyDE effectively performs zero-shot retrieval without needing any supervised relevance signals (Precise Zero-Shot Dense Retrieval without Relevance Labels, 2022).

- **Task Decomposition:** The approach reframes dense retrieval as two natural language understanding and generation tasks, replacing explicit relevance score modeling with example generation (Precise Zero-Shot Dense Retrieval without Relevance Labels, 2022).

- **Strong Performance:** HyDE significantly outperforms previous state-of-the-art zero-shot retrieval systems across a variety of datasets and languages, including low-resource languages such as Swahili and Korean (Precise Zero-Shot Dense Retrieval without Relevance Labels, 2022).

### Summary

HyDE innovatively uses a generative language model to hypothesize what a relevant document might look like for a given query, then encodes this hypothetical document to retrieve similar real documents. This method bypasses the need for labeled relevance data and complex training, enabling effective zero-shot dense retrieval through a combination of generation and unsupervised contrastive encoding.

## Sources

- Precise Zero-Shot Dense Retrieval without Relevance Labels (2022)","HyDE is a zero-shot dense retrieval technique where an LLM first generates a hypothetical answer/document for a query, and that synthetic document is then embedded and used as the query vector for nearest-neighbor search.",0.999999999975,1.0,1.0,0.9903313811498053,definitional
What does the term 'faithfulness' mean as a RAGAS metric?,"['We consider a standard RAG setting, where given a question _q_ , the system first retrieves some context _c_ ( _q_ ) and then uses the retrieved context to generate an answer _as_ ( _q_ ). When building a RAG system, \n\nwe usually do not have access to human-annotated datasets or reference answers. We therefore focus on metrics that are fully self-contained and reference-free. We focus in particular three quality aspects, which we argue are of central importance. First, **Faithfulness** refers to the idea that the answer should be grounded in the given context. This is important to avoid hallucinations, and to ensure that the retrieved context can act as a justification for the generated answer. Indeed, RAG systems are often used in applications where the factual consistency of the generated text w.r.t. the grounded sources is highly important, e.g. in domains such as law, where information is constantly evolving. Second, **Answer Relevance** refers to the idea that the generated answer should address the actual question that was provided. Finally, **Context Relevance** refers to the idea that the retrieved context should be focused, containing as little irrelevant information as possible. This is important given the cost associated with feeding long context passages to LLMs. Moreover, when context passages are too long, LLMs are often less effective in exploiting that context, especially for information that is provided in the middle of the context passage (Liu et al., 2023). \n\nWe now explain how these three quality aspects can be measured in a fully automated way, by prompting an LLM. In our implementation and experiments, all prompts are evaluated using the gpt-3.5-turbo-16k model, which is available through the OpenAI API[2] . \n\n**Faithfulness** We say that the answer _as_ ( _q_ ) is faithful to the context _c_ ( _q_ ) if the claims that are made in the answer can be inferred from the context. To estimate faithfulness, we first use an LLM to extract a set of statements, _S_ ( _as_ ( _q_ )). The aim of this step is to decompose longer sentences into shorter and more focused assertions. We use the following prompt for this step[3] : \n\n_Given a question and answer, create one or more statements from each sentence in the given answer._ \n\n_question:_ [question] _answer:_ [answer] \n\nwhere [', 'metrics are much closer aligned with the human judgements than the predictions from the two baselines. For faithfulness, the Ragas prediction are in general highly accurate. For answer relevance, the agreement is lower, but this is largely due to the fact that the differences between the two candidate answers are often very subtle. We found context relevance to be the hardest quality dimension to evaluate. In particular, we observed that ChatGPT often struggles with the task of selecting the sentences from the context that are crucial, especially for longer contexts.', 'Table 1 analyses the agreement between the metrics proposed in Section 3 and the human assessments from the proposed WikiEval dataset. Each WikiEval instance requires the model to compare two answers or two context fragments. We count how often the answer/context preferred by the model (i.e. with highest estimated faithfulness, answer relevance, or context relevance) coincides with the answer/context preferred by the human annotators. We report the results in terms of accuracy (i.e. the fraction of instances on which the model agrees with the annotators). \n\nTo put the results in context, we compare our proposed metrics (shown as _Ragas_ in Table 1) with two baseline methods. For the first method, shown as _GPT Score_ , we ask ChatGPT to assign a score between 0 and 10 for the three quality dimensions. To this end, we use a prompt that describes the meaning of the quality metric and then asks to score the given answer/context in line with that definition. For instance, for evaluating faithfulness, we used the following prompt: \n\n- _Faithfulness measures the information consistency of the answer against the given context. Any claims that are made in the answer that cannot be deduced from context should be penalized. Given an answer and context, assign a score for faithfulness in the range 0-10. context_ : [context] _answer_ : [answer] \n\nTies, where the same score is assigned by the LLM to both answer candidates, were broken randomly. The second baseline, shown as _GPT Ranking_ , instead asks ChatGPT to select the preferred answer/- \n\ncontext. In this case, the prompt again includes a definition of the considered quality metric. For instance, for evaluating answer relevance, we used the following prompt: \n\n- _Answer Relevancy measures the degree to which a response directly addresses and is appropriate for a given question. It penalizes the present of redundant information or incomplete answers given a question. Given an question and answer, rank each answer based on Answer Relevancy._ \n\n_question_ : [question] _answer 1_ : [answer 1] _answer 2_ : [answer 2] \n\nThe results in Table 1 show that our proposed metrics are much closer aligned with the human judgements than the predictions from the two baselines. For faithfulness, the Ragas prediction are in general highly accurate. For answer relevance, the agreement is lower, but this is largely due to the fact', '**Faithfulness** To obtain human judgements about faithfulness, we first used ChatGPT to answer the question without access to any additional context. We then asked the annotators to judge which of the two answers was the most faithful (i.e. the standard one or the one generated without context), given the question and corresponding Wikipedia page. \n\n**Answer relevance** We first used ChatGPT to obtain candidate answers with lower answer relevance, using the following prompt: \n\n- _Answer the given question in an incomplete manner._ \n\n_question:_ [question] \n\nWe then asked human annotators to compare this answer, and indicate which of the two answers had the highest answer relevance. \n\n**Context relevance** To measure this aspect, we first added additional sentences to the context by scraping back-links to the corresponding Wikipedia page. In this way, we were able to add information to the context that was related but less relevant for \n\n||**Faith.**|**Ans. Rel.**|**Cont. Rel.**|\n|---|---|---|---|\n|Ragas|**0.95**|**0.78**|**0.70**|\n|GPT Score|0.72|0.52|0.63|\n|GPT Ranking|0.54|0.40|0.52|\n\n\n\nTable 1: Agreement with human annotators in pairwise comparisons of faithfulness, answer relevance and context relevance, using the WikEval dataset (accuracy). \n\nanswering the question. For the few pages without any back-links, we instead used ChatGPT to complete the given context.']","## Meaning of 'Faithfulness' as a RAGAS Metric

In the context of RAGAS (Automated Evaluation of Retrieval Augmented Generation), **faithfulness** refers to the degree to which an answer generated by a RAG system is **grounded in the retrieved context**. Specifically, an answer is considered faithful if the claims it makes can be directly inferred from the provided context documents rather than being fabricated or hallucinated (Ragas: Automated Evaluation of Retrieval Augmented Generation, 2023).

### Key Aspects of Faithfulness in RAGAS

- **Grounding in Context:** Faithfulness ensures that the generated text remains factually consistent with the retrieved information, avoiding hallucinations or unsupported claims.
- **Statement Extraction:** RAGAS uses a large language model (LLM) to extract individual statements from the generated answers. These statements are then evaluated to verify if they are supported by the retrieved context.
- **Automated, Reference-Free Evaluation:** The faithfulness metric is part of an automated framework that does not require ground truth answers for evaluation, making it practical for real-world RAG system development.
- **Alignment with Human Judgments:** RAGAS's faithfulness predictions have been shown to closely match human evaluations, achieving a high accuracy score of 0.95, indicating reliable assessment performance.
- **Role in Quality Assessment:** Faithfulness is one of the core quality dimensions evaluated by RAGAS, alongside answer relevance and context relevance, helping developers understand and improve the factual reliability of their RAG systems.

### Importance of Faithfulness

Faithfulness is critical because it directly addresses the problem of hallucinations in generated text, ensuring that the output is trustworthy and factually accurate based on the retrieved documents. This makes faithfulness a vital metric for evaluating and improving retrieval-augmented generation systems.

## Sources

- Ragas: Automated Evaluation of Retrieval Augmented Generation, 2023",Faithfulness measures whether the generated answer is grounded in the retrieved context: claims in the answer that cannot be supported by the retrieved chunks count against the score.,0.8055555555287036,1.0,0.9473684210526315,0.9441307680582582,definitional
