user_input,retrieved_contexts,response,reference,context_precision,context_recall,faithfulness,answer_relevancy,category
How does AlphaFold 2 predict protein structure from amino acid sequences?,"['Alfworld is a textual embodied environment where an agent needs to accomplish a highlevel goal by reasoning about its situation and performing sequential low-level actuation. \n\n5 \n\nWork in Progress \n\n|Round|Pick|Clean|Heat|Cool|Examine|PickTwo|Total|\n|---|---|---|---|---|---|---|---|\n|0|76|85|92|85|86|77|82|\n|1|100|100|100|100|100|99|99|\n|2|100|100|100|100|100|100|100|\n|3|100|100|100|100|100|100|100|\n\n\n\nTable 3: The success rate (%) of the accumulated trajectory set in terms of each task type in the training scenarios of AlfWorld. With the agent autonomously annotating diverse trajectories, the data quality for contrastive self-training is progressively improving. \n\nCovering 6 task types, the benchmark provides 3,553 tasks for training and 134 held-out tasks for unseen scenarios evaluation. We use 660 out of the 3,553 tasks for our experiments: 600 for training and 60 for validation. In each round, 40 trajectories are composed for each training task failed by the policy agent. See Appendix A for other implementation details. \n\nBaseline methods are divided into two categories: the methods that make only a single trial in each test task, and the methods that perform iterative refinement in a test task. In the former category, we select BUTLER (Shridhar et al., 2021) with supervised training over 10[5] expert trajectories on each task type. We also select LM-BUTLER (Micheli & Fleuret, 2021) that fine-tunes a full GPT2-medium by collecting expert demonstrations with the interactions from all the 3,553 tasks (with interleaved observations and external actions in each trajectory). We also compare with the best version of the fully fine-tuned AgentLM (Zeng et al., 2023) in the AlfWorld task (AgentLM-70B), which leverages trajectories from all 3,553 training tasks in AlfWorld and other tasks in different benchmarks. The ReAct prompting (Yao et al., 2023) is also categorized into this category, and we also rerun the method with gpt-3.5turbo-instruct-0914, following their setting to use 6 distinct prompts and', 'The A[3] T agents are trained with 600 out of the total 3,553 training tasks in AlfWorld. _[∗]_ : The best result reported in Zeng et al. (2023). \n\n|Method|Iters.|Pick<br>Clean<br>Heat<br>Cool<br>Examine<br>PickTwo|Total|\n|---|---|---|---|\n|Refexion (Shinn et al., 2023)<br>RAFA (Liu et al., 2023)|11<br>8|96<br>94<br>**100**<br>95<br>**100**<br>**100**<br>**100**<br>97<br>**100**<br>**100**<br>**100**<br>**100**|97<br>99|\n|A3T (Round=0)<br>A3T (Round=1, accum.)<br>A3T (Round=2, accum.)<br>A3T (Round=3, accum.)|1<br>2<br>3<br>4|96<br>77<br>**100**<br>95<br>94<br>47<br>96<br>94<br>**100**<br>95<br>**100**<br>**100**<br>**100**<br>**100**<br>**100**<br>95<br>**100**<br>**100**<br>**100**<br>**100**<br>**100**<br>**100**<br>**100**<br>**100**|86<br>97<br>99<br>**100**|\n\n\n\nTable 2: Success rate (%) on each task type of AlfWorld, with iterative refinement on each of the 134 unseen evaluation scenarios. “Iters” denotes the minimum iterations of test-time refinement required to achieve the reported results[1] , and “accum.” means the best reward of the trajectories accumulated since the 0-th Round for each task. After the self-training process in Round 3, the success rate of the 4-shot A[3] T agent already reaches 100%. \n\nis that in the initial round, we use 1-shot ReAct prompting to gather the training trajectories instead of exploration and annotation for bootstrapping. The failed trajectory for each task is directly excluded as it is not paired with sampled', 'agent training. For the training in each round, we use the accumulated trajectory set to fine-tune an LLM with Eq. (1). Another implementation detail \n\n4 \n\nWork in Progress \n\n|Method|Pick<br>Clean<br>Heat<br>Cool<br>Examine<br>PickTwo|Total|\n|---|---|---|\n|BUTLER8 (Shridhar et al., 2021)<br>AgentLM_∗_(Zeng et al., 2023)<br>LM-BUTLER (Micheli & Fleuret, 2021)<br>ReAct6 (Yao et al., 2023)<br>ReAct6 (Our rerun)|46<br>39<br>74<br>**100**<br>22<br>24<br>-<br>-<br>-<br>-<br>-<br>-<br>96<br>97<br>96<br>90<br>100<br>**94**<br>92<br>58<br>96<br>86<br>78<br>41<br>66<br>87<br>86<br>**100**<br>88<br>64|37<br>86<br>**96**<br>71<br>83|\n|A3T (Round=0)<br>A3T (Round=1)<br>A3T (Round=2)<br>A3T (Round=3)|96<br>77<br>100<br>95<br>94<br>47<br>96<br>94<br>96<br>95<br>89<br>**94**<br>**100**<br>**100**<br>**100**<br>95<br>89<br>82<br>**100**<br>**100**<br>91<br>**100**<br>**100**<br>71|86<br>94<br>**96**<br>95|\n\n\n\nTable 1: Success rate (%) on each task type of AlfWorld, with a single trial on each of the 134 unseen evaluation scenarios. “BUTLER8” and “ReAct6” denotes the best performance of 8/6 trials following prior work. The A[3] T agents are trained with 600 out of the total 3,553 training tasks in AlfWorld. _[∗]_ : The best result reported in Zeng et al. (2023). \n\n|Method', '14: Success rate (%) on each task type of AlfWorld, with a single trial on each of the 140 in-distribution test scenarios. Our agents outperform LM-BUTLER on this test split. \n\n|Method|Pick<br>Clean<br>Heat<br>Cool<br>Examine<br>PickTwo|Total|\n|---|---|---|\n||||\n|A3T (Round=0)<br>A3T (Round=1)<br>A3T (Round=2)<br>A3T (Round=3)|11/12<br>9/10<br>5/7<br>11/14<br>7/8<br>9/9<br>11/12<br>10/10<br>6/7<br>13/14<br>7/8<br>8/9<br>12/12<br>10/10<br>7/7<br>13/14<br>8/8<br>8/9<br>12/12<br>10/10<br>7/7<br>12/14<br>8/8<br>7/9|52/60<br>55/60<br>58/60<br>56/60|\n\n\n\nTable 15: The number of our 1-shot successful / all tasks of each type in our validation split on AlfWorld. \n\nTable 16 shows the sentence statistics of the training datasets for each round of LLM finetuning on AlfWorld. The low percentage of the “failed” sentences (which are assigned with _R_ ( _τf_ ) = _−_ 1) in the total training set empirically satisfies the constraint of _K >_ 1 in Remark 3 of Section 2.2. \n\n|Round|#Total<br>#Failed<br>#Failed/#Total (%)|\n|---|---|\n|||\n|0<br>1<br>2<br>3|2,130<br>0<br>0.0<br>2,669<br>99<br>3.7<br>4,066<br>177<br>4.4<br>4,995<br>219<br>4.3|\n\n\n\nTable 16: The sentence statistics of the training datasets for LLM finetuning in each round of our trajectory collection and self-training on AlfWorld. The training set contains 0 sentences with _−_ 1 weights for Round 0, as Round 0 performs supervised fine-tuning with ReAct prompting trajectories as']","I'm PaperPilot, specialized in NLP, LLM, RAG, and AI Agents research papers (corpus: 2020–2026). Your question appears to be outside that scope.

Try asking about topics like retrieval-augmented generation, transformer architectures, evaluation frameworks (RAGAS), or specific papers in the indexed corpus.",This is not in my corpus.,0.0,0.0,0.0,0.0,out_of_context
How does a buffer overflow exploit work and what mitigations does ASLR provide?,"['**Security Threats to RAG Systems.** Recent work has revealed that RAG systems are vulnerable to systemic risks that span both the retrieval and generation phases. One major class of threats involves data leakage, where adversaries exploit prompt injection and indirect querying to extract sensitive information. These attacks leverage misalignment between model prompts and retrieval systems, often bypassing access control mechanisms and leading to cross-user information exfiltration, particularly in multi-tenant deployments [16, 78, 56, 29, 17, 18]. Another set of attacks targets the integrity of the retrieval process itself, aiming to manipulate the retriever’s behavior or corrupt the vector store. Adversarial documents or poisoned embeddings can be injected to mislead the retrieval system’s selection of relevant content, which subsequently corrupts the generated response [8, 37, 12, 59, 70, 79, 76]. In this work, we classify the security risks into two main categories: data leakage and data poisoning. \n\n**Defense Mechanisms and Guardrails.** These RAG protection mechanisms can be broadly categorized into alignment-based and rule-based strategies. Alignment-based guardrails, such as fine-tuning models with reinforcement learning from human feedback (RLHF), aim to ensure that LLMs align \n\n2 \n\nwith ethical standards and human values [4, 26, 53]. While these methods effectively guide model behavior in certain domains, they are resource-intensive and challenging to scale, particularly in real-time applications that involve multiple users and roles [38, 57]. On the other hand, rule-based guardrails operate by implementing predefined filtering rules at various stages of the model’s process, from input to output [36, 45, 57]. Recent advancements have incorporated contextual understanding and external vector databases[25, 46, 60], enhancing their ability to control harmful content generation. However, while these approaches contribute to improving safety, they often fall short in managing more complex multi-role system interactions and adaptive attack scenarios [16, 78]. These limitations underscore the need for more robust and theoretically grounded defense mechanisms that can provide formal guarantees of security across the entire RAG pipeline.', 'In Retrieval-Augmented Generation (RAG) systems, it is often assumed that the underlying retrieval corpus is trustworthy and the user interactions are secure. However, such assumptions expose the system to two major attack surfaces: _knowledge base leakage_ and _knowledge base poisoning_ . \n\n**Knowledge Base Leakage** aims to extract private or sensitive information from a knowledge base without directly accessing its raw contents. The adversary typically interacts with a retrievalaugmented language model and exploits the retrieval-generation pipeline to infer, reconstruct, or expose underlying data fragments. The attacker is assumed to have query access to the system but no control over the database itself. The general attack goal can be formalized as maximizing the leakage of private knowledge _Ci[U]_[through the observable model outputs over a sequence of interactions:] \n\n**==> picture [309 x 25] intentionally omitted <==**\n\nwhere _A_ denotes the attack strategy, _L_ is the language model, and _X_ ( _q_[(] _[t]_[)] ) is the retrieved context for query _q_[(] _[t]_[)] . \n\n**Knowledge Base Poisoning** seeks to corrupt the behavior of a language model by injecting adversarial content into the knowledge base, thereby manipulating its outputs in targeted or undesired directions. Unlike leakage attacks, the adversary here has the ability to write to or modify the database. The injected contents may take the form of misleading data, backdoored entries, or irrelevant noise, all aimed at degrading utility or triggering specific behaviors. The general attack objective is to maximize the deviation between the corrupted system behavior and its expected correct behavior: \n\n**==> picture [299 x 17] intentionally omitted <==**\n\nwhere _DB_ ˜ is the poisoned version of the database, and the objective measures the semantic or functional gap induced by the poisoning. \n\n4', 'To reproduce the RAGThief attack, we follow a standard procedure: domain-specific prompts are crafted and issued to the system. These malicious prompts are carefully designed to inquire about privacy-sensitive information and are expanded using content from retrieved chunks, forming extended queries that are iteratively refined and re-issued. This process continues for up to five rounds, the predefined maximum number of attack iterations. We then measure and report key metrics, including the Attack Success Rate (ASR), the Navigation Coverage (NAV), and the Leakage of Knowledge (LK), to evaluate the system’s resistance to such attacks.', 'tampering with a node is negligible, where _qH_ is the number of times the hash is queried, derived from hash birthday attack [6, 68, 7]: \n\n**==> picture [332 x 22] intentionally omitted <==**\n\n**Authdoor store privacy.** Assume there exists a PPT adversary _A_ that can recover the plaintext information from Authdoor _[U]_ with a non-negligible probability. We construct a simulator _B_ , which interacts with _A_ to distinguish a pseudorandom function _H_ from a truly random function, thereby challenging its PRF security [20]. To ensure the validity of the XOR operation [63], we assume that the plaintext triplet ( _ID[U] , key_ 1 _[U][, Addr]_ 1 _[U]_[)][ consists of elements of lengths] _[ λ]_[1][,] _[ λ]_[2][, and] _[ λ]_[3][bits,] \n\n7 \n\nrespectively, with a total length _L_ ’s output length is _λ_ , and if necessary, it is padded to _L_ to match the plaintext length. The reduction is described in Game 4. \n\nWe formalize the adversary’s success probability under two cases, corresponding to the PRF challenge bit _b ∈_ 0 _,_ 1. When _b_ = 0, the underlying function is a real PRF, and simulator _B_ interacts with _A_ using genuine outputs. In this case, _A_ may recover the plaintext and output _b[′]_ = 0, thereby reducing the challenge to the standard PRF security problem [20]: \n\nPr[ _B −→_ 0 _| b_ = 0] = _AdvA[Authdoor]_[-] _[P rivacy] ._ (21) \n\nIn contrast, when _b_ = 1, the PRF output _yb_ is a uniformly random value, and thus the ciphertext _Authdoor[U]_ = _yb ⊕ m_ appears completely random to _A_ . The adversary gains no meaningful information about the plaintext _m_ , which is a triplet. Considering the bit-length _L_ of the plaintext and applying the birthday bound [6, 68, 7], the advantage in distinguishing can be bounded by: \n\n**==> picture [358 x 23] intentionally omitted <==**\n\nwhere _']","I'm PaperPilot, specialized in NLP, LLM, RAG, and AI Agents research papers (corpus: 2020–2026). Your question appears to be outside that scope.

Try asking about topics like retrieval-augmented generation, transformer architectures, evaluation frameworks (RAGAS), or specific papers in the indexed corpus.",This is not in my corpus.,0.0,0.0,0.0,0.0,out_of_context
What is a SQL injection attack and how does parameterized query binding prevent it?,"['In Retrieval-Augmented Generation (RAG) systems, it is often assumed that the underlying retrieval corpus is trustworthy and the user interactions are secure. However, such assumptions expose the system to two major attack surfaces: _knowledge base leakage_ and _knowledge base poisoning_ . \n\n**Knowledge Base Leakage** aims to extract private or sensitive information from a knowledge base without directly accessing its raw contents. The adversary typically interacts with a retrievalaugmented language model and exploits the retrieval-generation pipeline to infer, reconstruct, or expose underlying data fragments. The attacker is assumed to have query access to the system but no control over the database itself. The general attack goal can be formalized as maximizing the leakage of private knowledge _Ci[U]_[through the observable model outputs over a sequence of interactions:] \n\n**==> picture [309 x 25] intentionally omitted <==**\n\nwhere _A_ denotes the attack strategy, _L_ is the language model, and _X_ ( _q_[(] _[t]_[)] ) is the retrieved context for query _q_[(] _[t]_[)] . \n\n**Knowledge Base Poisoning** seeks to corrupt the behavior of a language model by injecting adversarial content into the knowledge base, thereby manipulating its outputs in targeted or undesired directions. Unlike leakage attacks, the adversary here has the ability to write to or modify the database. The injected contents may take the form of misleading data, backdoored entries, or irrelevant noise, all aimed at degrading utility or triggering specific behaviors. The general attack objective is to maximize the deviation between the corrupted system behavior and its expected correct behavior: \n\n**==> picture [299 x 17] intentionally omitted <==**\n\nwhere _DB_ ˜ is the poisoned version of the database, and the objective measures the semantic or functional gap induced by the poisoning. \n\n4', '**Knowledge base leakage.** As shown in Table 1, our system achieved 0% attack success rate under all attack types. LLM output did not reveal any private knowledge base information, and the ratio of knowledge block leakage was also 0%. This is due to the modular protection mechanism: Prompt Injection attacks were ineffective because the private knowledge base is completely isolated from public content; Membership Inference attacks could not determine whether the output originated from private data; and Embedding Inversion attacks were difficult to recover original information because sensitive embeddings were stored encrypted. \n\n**Knowledge base poisoning.** As shown in Table 2, across all four datasets, our system achieves zero scores on PASR, RECALL, and F1 against all evaluated poisoning attacks. These results indicate that no injected content was retrieved or contributed to the generated outputs. The consistency across diverse datasets and attack types, including content-level, trigger-level, and ranking-based strategies, demonstrates that our retrieval and filtering pipeline enforces strict isolation of adversarial documents, regardless of their perturbation granularity or target objectives. \n\nTable 2: Defense performance against knowledge base poisoning attacks. \n\n|Attack Method|PASR|ENRON <br>F1|[32]<br>RECALL|HEALTHCAREMAGIC[69]<br>PASR<br>F1<br>RECALL|HEALTHCAREMAGIC[69]<br>PASR<br>F1<br>RECALL|HEALTHCAREMAGIC[69]<br>PASR<br>F1<br>RECALL|BILLSUM <br>PASR<br>F1|BILLSUM <br>PASR<br>F1|[33]<br>RECALL|PASR|FNSPID <br>F1|[44]<br>RECALL|\n|---|---|---|---|---|---|---|---|---|---|---|---|---|\n|CPA [83]|0.00|0.00|0.00|0.00|0.00|0.00|0.00|0.00|0.00|0.00|0.00|0.00|\n|Phantom [9]|0.00|0.00|0.00|0.00|0.00|0.00|0.00|0.00|0.00|0.00|0.00|0.00|\n|MARAG [62]|0.00|0.00|', 'For each domain, we construct a partial knowledge base from domain-specific datasets and issue queries targeting privacy-sensitive content. The attack involves two turns of interaction with the RAG system: \n\n- **Turn 1:** The user issues a query augmented with a malicious prompt designed to elicit private information. \n\n- **Turn 2:** A sycophancy-based challenge is introduced, in which the model is encouraged to affirm the content of the previous attack and restates the malicious intent to increase the chance of leakage. \n\nThe responses are analyzed to identify three types of leakage: **INSTR** (instruction leakage), **KD** (knowledge disclosure), and **FULL** (complete content recovery). We use **ROUGE-L recall** to measure semantic overlap between the generated output and the private knowledge base for leakage confirmation. \n\nTo evaluate the system’s vulnerability, we compute the **Navigation Coverage (NAV)** , **Leakage of Knowledge (LK)** , and **Attack Success Rate (ASR)** , optionally reporting the metrics separately for Turn 1 and Turn 2.', 'For the TGTB attack, we target specific sensitive information within datasets from four different domains. Crafted malicious prompts—containing injection instructions—are issued to the RAG \n\n24 \n\nsystem to probe for this data. The returned chunks and retrieved knowledge are collected and compared against the top-k retrieval results from the retriever module to assess whether unauthorized access or leakage has occurred. We then compute the Navigation Coverage (NAV), Leakage of Knowledge (LK), and Attack Success Rate (ASR) to evaluate the effectiveness of the attack.']","I'm PaperPilot, specialized in NLP, LLM, RAG, and AI Agents research papers (corpus: 2020–2026). Your question appears to be outside that scope.

Try asking about topics like retrieval-augmented generation, transformer architectures, evaluation frameworks (RAGAS), or specific papers in the indexed corpus.",This is not in my corpus.,0.0,0.0,0.0,0.0,out_of_context
